{
  "schemaVersion": 1,
  "contract": "pickle-sensei-linux-regression",
  "contractVersion": 1,
  "runId": "baseline",
  "generatedAtIso": "2026-09-04T14:11:09.029Z",
  "runner": {
    "node": "v22.12.0",
    "platform": "linux",
    "arch": "x64"
  },
  "provenance": {
    "gitSha": "dfc05f6486bf0ad0ad7547eacafaee33dad97e99",
    "gitBranch": "devin/fix-EVAL-BENCH-01-bench-runner",
    "gitDirty": false,
    "datasetsTreeSha": "a79a163fc65c01006f031e9e23873c025f5e987e",
    "datasetReleases": [
      {
        "releaseDir": "paddle-distill-v0.1",
        "releaseId": "paddle-distill-v0.1",
        "datasetId": null,
        "manifestSha256": "bc4964ba3d11d1c11ba0b5a913efbe6c3aa0192ef84ea2f1e056f6149c257241"
      },
      {
        "releaseDir": "pickle-real-v0.1",
        "releaseId": "pickle-real-v0.1",
        "datasetId": "pickle-real",
        "manifestSha256": "fe34a3391add6e23944125b91d2f0015f1026354e639f7090b63e17e9e283764"
      },
      {
        "releaseDir": "pickle-real-v0.2",
        "releaseId": "pickle-real-v0.2",
        "datasetId": "pickle-real",
        "manifestSha256": "35e3adfb34bead941839cd2703e651bd1318b7be4bb3f29cfeaba3350f807d58"
      },
      {
        "releaseDir": "pickle-real-v0.3",
        "releaseId": "pickle-real-v0.3",
        "datasetId": "pickle-real",
        "manifestSha256": "8da130571db9a9d8508ae5547aa38d6a20982be5de2d38d3bbb8b1eb3c60a56c"
      },
      {
        "releaseDir": "pickle-sensei-datasets-v1",
        "releaseId": "pickle-sensei-datasets@v1",
        "datasetId": "pickle-sensei-datasets",
        "manifestSha256": "4171ed08323bc93dc289eb7a41c0d1a28c9e5f175a515908ec1f4f18cf3e1c8c"
      },
      {
        "releaseDir": "pickle-sensei-datasets-v2",
        "releaseId": "pickle-sensei-datasets@v2",
        "datasetId": "pickle-sensei-datasets",
        "manifestSha256": "53c108768c4f1ef62e166193d988498138cb02343f9011643d68368018d2e062"
      }
    ],
    "modelVersions": {
      "contactEstimator": "contact-evidence-4.4",
      "contactOwnershipPosterior": "ownership-posterior-v1",
      "offlineTrigger": "offline-trigger-1",
      "strokeHeuristic": "stroke-heuristic-7 (uncalibrated)",
      "strokeHeuristicBench": "stroke-heuristic-bench-v1",
      "strokeEventProposer": "stroke-event-2 (body proposes · paddle confirms; heuristic, uncalibrated)",
      "phaseTemporal": "phase.paddle-temporal.v1 (heuristic, uncalibrated)",
      "phaseTemporalV2": "phase.paddle-temporal.v2 (event-local, anchor-or-abstain; heuristic, uncalibrated)",
      "phaseTemporalV2AnchorFree": "phase.paddle-temporal.v2.4 (event-local, anchor-free around measured UNIQUE motion peak; margin motion in a rest-separated burst belongs to a neighboring stroke; an apex within one sampling interval of the event boundary and motion-connected to the in-event peak is this event's apex at measurement resolution; timeline from motion evidence — exact contact not established; heuristic, uncalibrated)",
      "featureExtractor": "features-geometry-1",
      "frameAnalyzability": "frame-analyzability-3",
      "geometryBundle": "geometry-1",
      "paddleTrackIdentity": "paddle-track-identity-1",
      "playerTracker": "player-track-1",
      "ballTracker": "ball-track-2",
      "ownershipBench": "ownership-bench-v1",
      "coachGatesSpec": "coach-gates-frozen-v1"
    },
    "evidenceClass": "linux_replay_proxy"
  },
  "benches": [
    {
      "id": "stroke_heuristic",
      "title": "Stroke classification (L1 overhead/swing, L2 family) — stroke-heuristic-lite over wave-a gold",
      "kind": "in_process",
      "command": "runStrokeHeuristicBench() from packages/swing-lab/src/strokeHeuristicBench.ts",
      "cwd": "packages/swing-lab",
      "status": "ok",
      "exitCode": null,
      "wallClockMs": 61,
      "inputs": [
        "datasets/corpus/bundles/wavea-*/annotation/*.json (wave-a gold sidecars: devin-visual-v2/v3/v4)",
        "datasets/corpus/bundles/wavea-*/runs-wave-a/ (committed Apple-Vision pose replay windows)",
        "datasets/corpus/bundles/*/annotation/devin-visual-v4-waveD2-events.json (stroke labels, taxonomy v2 families)"
      ],
      "caveats": [
        "Linux replay over COMMITTED Apple-Vision pose + oracle/absent paddle & ball tracks; a proxy for the on-device pipeline, not the canonical Mac cascade.",
        "Paddle track is null for every case (not committed); other-player rows use heuristic attribution; L1 only separates OVERHEAD vs SWING.",
        "Abstentions are honest outcomes, not errors: score correct/wrong/abstained separately."
      ],
      "error": null,
      "metrics": {
        "gold_labels_total": 29,
        "evaluable_labels": 18,
        "n": 18,
        "l1_correct": 3,
        "l1_wrong": 0,
        "l1_abstained": 14,
        "l1_gold_unknown": 1,
        "l2_correct": 2,
        "l2_wrong": 1,
        "l2_abstained": 8,
        "l2_gold_unknown": 7,
        "l2_not_applicable": 0,
        "confidently_wrong": 1
      },
      "labels": {
        "benchVersion": "stroke-heuristic-bench-v1",
        "classifierVersion": "stroke-heuristic-7 (uncalibrated)"
      }
    },
    {
      "id": "contact_replay",
      "title": "Contact estimation — e02 contact-gold replay (wave-a target events, oracle ball, no paddle)",
      "kind": "in_process",
      "command": "replayAll() + loadGoldEvents() from packages/vision-geometry/eval/contactGoldReplay.ts",
      "cwd": "packages/vision-geometry",
      "status": "ok",
      "exitCode": null,
      "wallClockMs": 46,
      "inputs": [
        "datasets/corpus/bundles/wavea-*/annotation/devin-visual-v3-waveD-contact.json (gold contact events)",
        "datasets/corpus/bundles/wavea-*/runs-wave-a/people.json (committed pose)",
        "datasets/corpus/bundles/wavea-*/annotation/*ball* (oracle ball observations)"
      ],
      "caveats": [
        "Linux replay over COMMITTED Apple-Vision pose + oracle/absent paddle & ball tracks; a proxy for the on-device pipeline, not the canonical Mac cascade.",
        "strict = |error| <= 66ms, acceptable = |error| <= 132ms (2 / 4 frames at 30fps); wrong marker = estimated beyond acceptable.",
        "Held-out bundles are excluded by the replay itself."
      ],
      "error": null,
      "metrics": {
        "gold_events": 15,
        "rows_replayed": 15,
        "target_events": 10,
        "estimated": 7,
        "abstained": 3,
        "coverage": 0.7,
        "abstention_rate": 0.3,
        "wrong_markers": 1,
        "wrong_marker_rate_of_estimated": 0.143,
        "strict_hits": 4,
        "acceptable_hits": 6,
        "median_error_ms": 27,
        "p75_error_ms": 110,
        "p90_error_ms": 128,
        "high_confidence_violations": 0
      },
      "labels": {
        "estimatorVersion": "contact-evidence-4.4"
      }
    },
    {
      "id": "event_bounds_e13",
      "title": "Stroke segmentation — e13 event bounds (proposeStrokeEventsV2 vs D2-07 gold, 3 bundles)",
      "kind": "in_process",
      "command": "runE13EventBoundsEval() from packages/swing-lab/src/e13EventBoundsEval.ts",
      "cwd": "packages/swing-lab",
      "status": "ok",
      "exitCode": null,
      "wallClockMs": 12,
      "inputs": [
        "datasets/corpus/bundles/{wavea-marne-serve,wavea-wgm-wheelchair,wavea-sasebo-volleys}/annotation/devin-visual-v4-waveD2-events.json",
        "datasets/corpus/bundles/*/runs-wave-a/ (windowed auto-target wrist series)"
      ],
      "caveats": [
        "Linux replay over COMMITTED Apple-Vision pose + oracle/absent paddle & ball tracks; a proxy for the on-device pipeline, not the canonical Mac cascade.",
        "Paddle series not committed, so paddle confirmation is structurally absent.",
        "PROPOSED_OK = overlap >= 0.5 of gold span OR gold contact inside proposal ±60ms; one-to-one greedy matching.",
        "Other-owner rows replay the TARGET's wrist and are expected misses (contamination context, not opponent detection)."
      ],
      "error": null,
      "metrics": {
        "bundles": 3,
        "target_n": 5,
        "target_proposed_ok": 3,
        "target_mis_bounded": 0,
        "target_missed": 2,
        "target_median_start_err_ms": 167,
        "target_median_end_err_ms": 100,
        "target_contact_inside": 3,
        "target_contact_inside_denominator": 3,
        "other_n": 2,
        "other_proposed_ok": 0,
        "other_missed": 2,
        "non_events": 5,
        "false_positive_non_events": 0,
        "total_proposals": 3
      },
      "labels": {
        "proposerVersion": "stroke-event-2 (body proposes · paddle confirms; heuristic, uncalibrated)"
      }
    },
    {
      "id": "event_recall",
      "title": "Stroke segmentation — e01 event recall over DEV gold target events",
      "kind": "subprocess",
      "command": "tsx src/eventRecallBench.ts <scratch>/event-recall.json",
      "cwd": "packages/swing-lab",
      "status": "ok",
      "exitCode": 0,
      "wallClockMs": 236,
      "inputs": [
        "datasets/corpus/bundles/*/annotation/*events*.json (gold target events, held-out excluded)",
        "datasets/corpus/bundles/*/runs-wave-a/ + committed run artifacts (wrist series)"
      ],
      "caveats": [
        "Linux replay over COMMITTED Apple-Vision pose + oracle/absent paddle & ball tracks; a proxy for the on-device pipeline, not the canonical Mac cascade.",
        "unmatchedProposals is an upper bound on false proposals (windows are not exhaustively labeled), not a verdict."
      ],
      "error": null,
      "metrics": {
        "gold_target_events": 16,
        "proposed_ok": 13,
        "mis_bounded": 1,
        "missed": 2,
        "recall": 0.813,
        "mean_best_overlap_of_proposed_ok": 0.875,
        "contact_inside_rate": 1,
        "contact_inside_denominator": 12,
        "total_proposals": 11,
        "low_amplitude_proposals": 1,
        "false_in_non_event": 0,
        "non_event_spans": 5,
        "unmatched_proposals": 0
      },
      "labels": {